title,company,description,salary_min,salary_max
"Senior Data Analyst, Commercial & Operations",Aurora Innovation,"Who we are Aurora’s mission is to deliver the benefits of self-driving technology safely, quickly, and broadly. The Aurora Driver will create a new era in mobility and logistics, one that will bring a safer, more efficient, and more accessible future to everyone. At Aurora, you will tackle massively complex problems alongside other passionate, intelligent individuals, growing as an expert while expanding your knowledge. For the latest news from Aurora, visit aurora.tech or follow us on LinkedIn…",115000.0,170000.0
"Senior Data Analyst, Workforce Strategy",Aurora Innovation,"Who we are Aurora’s mission is to deliver the benefits of self-driving technology safely, quickly, and broadly. The Aurora Driver will create a new era in mobility and logistics, one that will bring a safer, more efficient, and more accessible future to everyone. At Aurora, you will tackle massively complex problems alongside other passionate, intelligent individuals, growing as an expert while expanding your knowledge. For the latest news from Aurora, visit aurora.tech or follow us on LinkedIn…",115000.0,167000.0
"Sr. Data Analyst, Financial Analytics",Sunrun,"Ever since we started in 2007, Sunrun has been at the forefront of connecting people to the cleanest energy on Earth. It’s why we’ve become the 1 home solar and battery company in America. Today, we’re on a mission to change the way the world interacts with energy, and we’re building a company and brand that puts power at the center of life. And we’re doing it by designing a dynamic culture where employee development, well-being, and safety come first. We’re unlike any other solar company. Our …",110232.0,146976.0
Senior People Systems and Data Analyst,Freenome,"About this opportunity: Freenome is seeking a highly analytical and systems-savvy Senior People Systems and Data Analyst to elevate our People data capabilities and drive insight-led decision-making. This role will own the development of dashboards, analytics, and reporting that provide visibility into workforce trends and inform hiring, retention, engagement, and organizational planning strategies. This individual will transform People data into actionable insights through advanced analytics, …",120275.0,170100.0
"Data Analyst II, Customer Reporting",Spring Health,"Our mission: to eliminate every barrier to mental health. At Spring Health, we’re on a mission to revolutionize mental healthcare by removing every barrier that prevents people from getting the help they need, when they need it. Our clinically validated technology, Precision Mental Healthcare , empowers us to deliver the right care at the right time—whether it’s therapy, coaching, medication, or beyond—tailored to each individual’s needs. We proudly partner with over 450 companies, from startup…",125000.0,142000.0
GTM Data Analyst - Integrated Campaigns,Intercom,"Intercom is the AI Customer Service company on a mission to help businesses provide incredible customer experiences. Our AI agent Fin, the most advanced customer service AI agent on the market, lets businesses deliver always-on, impeccable customer service and ultimately transform their customer experiences for the better. Fin can also be combined with our Helpdesk to become a complete solution called the Intercom Customer Service Suite, which provides AI enhanced support for the more complex o…",153000.0,182750.0
DELTA DENTAL: Senior Data Analyst,Elevated Resources,"* This position is responsible for developing, implementing, and validating utilization and cost models which characterize providers' claims submissions and treatment patterns Additional responsibilities include determining if dentists are meeting the terms of participation in provider networks throughout the Enterprise and gathering and analyzing data from Enterprise repositories for recruitment purposes. * Performs queries, maintains integrity of databases and repositories and collects data t…",129712.05,129712.05
"Data Analyst, Growth - San Francisco",Plaud,"About Plaud Inc. Plaud is building the world's most trusted AI work companion for professionals to elevate productivity and performance through note-taking solutions, loved by over 1,500,000 users worldwide since 2023. With a mission to amplify human intelligence, Plaud is building the next-generation intelligence infrastructure and interfaces to capture, extract, and utilize what you say, hear, see, and think. Plaud Inc. is a Delaware-incorporated, San Francisco-based company pushing the bound…",82341.09,82341.09
"Senior Data Analyst, Trust & Safety",Chime Financial,"About the role As a Trust & Safety Product Analyst, you will have the opportunity to develop, test, launch and scale member banking experience products that build security awareness and adoption, keeping our members and Chime safe. Trust & Safety organization’s mission is to make Chime the most trusted financial partner by safeguarding member assets, ensuring regulatory excellence, and enhancing the tools and processes that protect our community, while delivering a seamless experience that work…",131149.34,131149.34
Senior Data Analyst (market-media domain),"Pyramid Technology Solutions, Inc.","Senior Data Analyst Client is based out of San Francisco, CA, New York, NY, Seattle, WA, or Little Rock, AR Note Remote is also ok if you find the right candidate, he will have to work in the PST time zone Duration:- 12 Months You will: The Senior Data Analyst will work on reporting and analytics initiatives for client customers. This role will work in close collaboration with Customer Success, Product and Engineering teams. The analyst will be responsible for generating insights from Clean Roo…",139436.5,139436.5
Business Intelligence Analyst / Data Analyst (SQL),Waymo,"Waymo is an autonomous driving technology company with the mission to be the world's most trusted driver. Since its start as the Google Self-Driving Car Project in 2009, Waymo has focused on building the Waymo Driver—The World's Most Experienced Driver™—to improve access to mobility while saving thousands of lives now lost to traffic crashes. The Waymo Driver powers Waymo’s fully autonomous ride-hail service and can also be applied to a range of vehicle platforms and product use cases. The Waym…",168000.0,207000.0
"Senior, Data Analyst - Technical Account Management",Walmart,"Position Summary Become the foremost expert on Inscape's ACR data—knowing how it works, where it breaks, and how to adapt it for client needs. You are the bridge between our internal data teams and external clients. Internally, you partner with engineering to understand product rollouts and surface viewership trends. Externally, you are the trusted guide for data licensees and media clients—troubleshooting issues, educating on workflows, and overseeing audience segment creation. You ensure clie…",104000.0,202000.0
"Data Analyst, B2B Commercialization - San Francisco",Plaud,"About Plaud Inc. Plaud is building the world's most trusted AI work companion for professionals to elevate productivity and performance through note-taking solutions, loved by over 1,500,000 users worldwide since 2023. With a mission to amplify human intelligence, Plaud is building the next-generation intelligence infrastructure and interfaces to capture, extract, and utilize what you say, hear, see, and think. Plaud Inc. is a Delaware-incorporated, San Francisco-based company pushing the bound…",89966.98,89966.98
Data Science Analyst,Tatari,"Tatari is on a mission to revolutionize TV advertising. Founded in 2016 to help transform the antiquated world of TV advertising through the intelligent application of AI and machine learning, Tatari helps some of the world’s fastest growing brands including Chime, Calm, Tecovas, Manscaped, Saatva, and Liquid I.V ., reach their customers using linear and streaming TV ads. Our platform combines sophisticated media buying with proprietary analytics to turn TV advertising into an automated, digita…",108284.66,108284.66
Data & Impact Analyst,ECS,"Description SALARY: External Candidates: $33.45 - $33.95/Hour Internal Candidates: $34.45 - $34.95/Hour Based on Longevity SUMMARY OF DUTIES AND RESPONSIBILITIES: Under the supervision of the Director of Housing Services, the Data & Impact Analyst provides database system administration, daily data entry, relevant staff training, and coordinates contract compliance activities within the Housing Department. PRIMARY DUTIES AND RESPONSIBILITIES: 1. Perform contract compliance activities including …",69472.0,70616.0
"2026 Wealth Management, Summer Data Analyst (~3 months)",Royal Bank of Canada,"Job Description What is the opportunity? The 2026 program is based in San Francisco CA and runs from June 01,2026 – August 14, 2026. RBC is one of the world’s leading diversified financial services companies, distinguished by a long heritage of financial strength, integrity and unwavering dedication to our clients. RBC Wealth Management’s business is financial advising. Our financial advisors and their teams serve our clients and grow our business across the country in our different branch offi…",82456.68,82456.68
Business Data Analytics Analyst,Mercor,"About the job Mercor connects elite creative and technical talent with leading AI research labs. Headquartered in San Francisco, our investors include Benchmark , General Catalyst , Peter Thiel , Adam D'Angelo , Larry Summers , and Jack Dorsey . Position: Product Operations Specialist (Technical) Type: Contract Compensation: $60–$80/hour Location: Remote Role Responsibilities Support program execution strategy for multiple products and platforms. Initiate 0 to 1 efforts, accelerate execution, a…",130897.68,130897.68
Data Integration Analyst III,Info Image,"Summary of Position: The Data Integration Analyst III is a senior technical resource responsible for leading complex and high‑risk onboarding efforts, architecting end‑to‑end integration solutions, and serving as the primary escalation point for data integration issues. This role provides department‑wide leadership in process improvement, documentation governance, and technical oversight, while mentoring DIA I and II team members to ensure scalable, consistent, and high‑quality client integrati…",116789.45,116789.45
Data Operations Analyst - Instawork Robotics,Instawork,"Instawork is on a mission to create meaningful economic opportunities for skilled hourly professionals in communities around the globe. Our AI-powered labor marketplace helps local businesses scale, and enables global technology companies to push the frontiers of robotics and AI. Backed by world-class investors like Benchmark, Spark Capital, Craft Ventures, Greylock, Y Combinator, and others, we’re looking for exceptional talent to reimagine the way the world works. Instawork’s on-demand labor …",100000.0,140000.0
Senior Data Engineer / Analyst (Remote – US),Recruiting From Scratch,"Senior Data Engineer / Analyst (Remote – US) Title of Role: Senior Data Engineer / Analyst (Remote – US) Location: New York, remote Company Stage of Funding: Series B — Enterprise, B2B, Data Office Type: Remote Salary: $180K–$220K Company Description We're representing a dynamic company that serves as an end-to-end market research partner, designed to address the toughest B2B questions with confidence. With a strong focus on data-driven insights, our client is committed to empowering businesses…",180000.0,220000.0
$XXX/45min Paid Market Research Study for CIO in the Finance Sector,Ivy Exec,"Market research studies are paid engagements Ivy Exec conducts with clients to get feedback on certain topics. For this study, we are looking for key decision-makers and technical professionals to talk about how their organizations are engaging in AI/ML-related technologies . This is a strictly confidential research interview and will abide by the ESOMAR International Code covering confidentiality and privacy . ESOMAR is the European Society for Opinion and Marketing Research. These discussions…",85493.56,85493.56
Turkish Data Quality Analyst - California based,Welo Data,"The Bridge Between Human Judgment and AI Excellence Are you an experienced QA professional who knows how to mentor others and maintain a high bar for data integrity? Welo Data is seeking Data Quality Analysts for Project Perseus . This isn't just about labeling; you are the Quality Gatekeeper . You will bridge the gap between our Data Labeling Associates (DLAs) and Team Leads, ensuring that human feedback for cutting-edge Arabic AI models is not only accurate but world-class. The Mission: Leadi…",145783.14,145783.14
French Data Quality Analyst - California based,Welo Data,"The Bridge Between Human Judgment and AI Excellence Are you an experienced QA professional who knows how to mentor others and maintain a high bar for data integrity? Welo Data is seeking Data Quality Analysts for Project Perseus . This isn't just about labeling; you are the Quality Gatekeeper . You will bridge the gap between our Data Labeling Associates (DLAs) and Team Leads, ensuring that human feedback for cutting-edge Arabic AI models is not only accurate but world-class. The Mission: Leadi…",175665.66,175665.66
Italian Data Quality Analyst - California based,Welo Data,"The Bridge Between Human Judgment and AI Excellence Are you an experienced QA professional who knows how to mentor others and maintain a high bar for data integrity? Welo Data is seeking Data Quality Analysts for Project Perseus . This isn't just about labeling; you are the Quality Gatekeeper . You will bridge the gap between our Data Labeling Associates (DLAs) and Team Leads, ensuring that human feedback for cutting-edge Arabic AI models is not only accurate but world-class. The Mission: Leadi…",151935.52,151935.52
Arabic Data Quality Analyst - California based,Welo Data,"The Bridge Between Human Judgment and AI Excellence Are you an experienced QA professional who knows how to mentor others and maintain a high bar for data integrity? Welo Data is seeking Data Quality Analysts for Project Perseus . This isn't just about labeling; you are the Quality Gatekeeper . You will bridge the gap between our Data Labeling Associates (DLAs) and Team Leads, ensuring that human feedback for cutting-edge Arabic AI models is not only accurate but world-class. The Mission: Leadi…",173396.2,173396.2
German Data Quality Analyst - California based,Welo Data,"The Bridge Between Human Judgment and AI Excellence Are you an experienced QA professional who knows how to mentor others and maintain a high bar for data integrity? Welo Data is seeking Data Quality Analysts for Project Perseus . This isn't just about labeling; you are the Quality Gatekeeper . You will bridge the gap between our Data Labeling Associates (DLAs) and Team Leads, ensuring that human feedback for cutting-edge Arabic AI models is not only accurate but world-class. The Mission: Leadi…",166203.22,166203.22
Spanish Data Quality Analyst - California based,Welo Data,"The Bridge Between Human Judgment and AI Excellence Are you an experienced QA professional who knows how to mentor others and maintain a high bar for data integrity? Welo Data is seeking Data Quality Analysts for Project Perseus . This isn't just about labeling; you are the Quality Gatekeeper . You will bridge the gap between our Data Labeling Associates (DLAs) and Team Leads, ensuring that human feedback for cutting-edge Arabic AI models is not only accurate but world-class. The Mission: Leadi…",175302.5,175302.5
DELTA DENTAL: Senior Data Governance Analyst,Elevated Resources,"This job will partner with key business, analytics, and technology stakeholders to identify business challenges, formulate a data plan, drive the insights, and develop solutions to enable the business teams to perform at the highest levels. This individual is responsible for driving understanding and decision making from data, working with key executives down to analysts. This role is part of the Data and Analytics COE which consists of experts and advisors with a specific focus on generating b…",106272.71,106272.71
Data Science/Product Analyst,Hired Recruiters,"Data is core to how ClassDojo makes decisions. As our next senior data scientist, you’ll help build the world's leading consumer education business, one that is already reaching tens of millions of parents, teachers, and children. You’ll help grow ClassDojo to our next major milestone: serving 100 million active families, and 100 million in revenue, while deepening love for our brand. The data science function at ClassDojo is an equal partner to product, engineering and design. As a senior lead…",88609.51,88609.51
Portuguese (Brazil) Data Quality Analyst - California based,Welo Data,"The Bridge Between Human Judgment and AI Excellence Are you an experienced QA professional who knows how to mentor others and maintain a high bar for data integrity? Welo Data is seeking Data Quality Analysts for Project Perseus . This isn't just about labeling; you are the Quality Gatekeeper . You will bridge the gap between our Data Labeling Associates (DLAs) and Team Leads, ensuring that human feedback for cutting-edge Arabic AI models is not only accurate but world-class. The Mission: Leadi…",213618.69,213618.69
Portuguese (Portugal) Data Quality Analyst - California based,Welo Data,"The Bridge Between Human Judgment and AI Excellence Are you an experienced QA professional who knows how to mentor others and maintain a high bar for data integrity? Welo Data is seeking Data Quality Analysts for Project Perseus . This isn't just about labeling; you are the Quality Gatekeeper . You will bridge the gap between our Data Labeling Associates (DLAs) and Team Leads, ensuring that human feedback for cutting-edge Arabic AI models is not only accurate but world-class. The Mission: Leadi…",200424.11,200424.11
"Identity and Data Signals Sr. Analyst, Uber Advertising",Uber,"About the Role: The Uber Advertising team is seeking a Technical Audience Solutions and Data Signals senior analyst to grow our data monetization and audience taxonomy development. You will lead the strategy and implementation for Uber Advertising's audience taxonomy, data signal monetization, advanced contextual audience solutions and data integration partners. This is a unique IC role working on one of the most exciting data advertising teams that blends long-term strategic thinking with cons…",117188.31,117188.31
Data Quality Operations Analyst (Contract),Cartesia,"About Cartesia Our mission is to architect AI that learns from and interacts with the world like humans do. We're pioneering the model architectures that will make this possible. Our founding team met as PhDs at the Stanford AI Lab, where we invented State Space Models or SSMs, a new primitive for training efficient, large-scale foundation models. Our team combines deep expertise in model innovation and systems engineering paired with a design-minded product engineering team to build and ship c…",52000.0,83200.0
"Senior Data and Reporting Analyst, Total Rewards",Crusoe,"Crusoe is on a mission to accelerate the abundance of energy and intelligence . As the only vertically integrated AI infrastructure company built from the ground up, we own and operate each layer of the stack — from electrons to tokens — to power the world's most ambitious AI workloads. When you join Crusoe, you join a team that is building the future, faster. We're in the midst of the greatest industrial revolution of our time. The demand for AI compute is boundless, and power is a bottleneck.…",106000.0,129000.0
Associate - Salesforce Business Analyst & Data Quality Coordinator,Jordan Park Group,"Jordan Park provides investment management and financial advice to a distinct community of individuals, families, and institutions. Our clients have made extraordinary contributions to business, philanthropy, government, and society. Our team is composed of empathetic problem solvers with depth and diversity of experience. We embrace complexity and navigate challenges to empower clients to achieve their optimal outcomes. Our mission is to enhance lives and legacies. Associate - Salesforce Busin…",115000.0,150000.0
Tech Lead,Procyon TS,"Data Analytics - Data Analyst Elk Grove, CA Additional Comments: Please make sure that candidates have been using Tableau and SQL on a daily/weekly basis for the past 5 years. This role will: Use Tableau to create visualizations Use SQL to build tables Machine learning experience is not required",147162.25,147162.25
"Consultant, Data Engineer",IBM,"Introduction At IBM, work is more than a job - it's a calling: To build. To design. To code. To consult. To think along with clients and sell. To make markets. To invent. To collaborate. Not just to do something better, but to attempt things you've never thought possible. Are you ready to lead in this new era of technology and solve some of the world's most challenging problems? If so, lets talk. Your role and responsibilities We are in search of a skilled Consultant Data Engineer to join our e…",152804.47,152804.47
Product Designer,Julius AI,Julius is building AI Data Analyst and growing quickly. You'll be a key pillar of our team with the autonomy to own and shape design direction for the entire product experience. Design is a critical part of how we turn AI capabilities into an intuitive product for millions of knowledge workers with varying levels of technical know-how. Join us as a Product Designer to help tackle this. Every knowledge worker—from financial analysts to marketers to product managers—relies on data to make critica…,150000.0,190000.0
Senior Product Designer,Gamma,"About the role You'll design the experiences that help millions of people discover, try, and fall in love with Gamma. As the designer for our Growth team, you'll own design across onboarding flows, referral programs, and conversion optimization throughout our funnel. You'll ship experiments quickly, measure what works, and iterate based on data and user feedback. This role sits at the intersection of creativity and impact. You'll balance craft with velocity, testing bold ideas while maintaining…",180000.0,260000.0
"Director, Data Analytics ACO - Remote",Sound Physicians,"Job Details Description About Sound Headquartered in Tacoma, WA, Sound Physicians is a physician-founded and led, national, multi-specialty medical group made up of more than 1,000 business colleagues and 4,000 physicians, APPs, CRNAs, and nurses practicing in 400-plus hospitals across 45 states. Founded in 2001, and with specialties in emergency and hospital medicine, critical care, anesthesia, and telemedicine, Sound has a reputation for innovating and leading through an ever-changing healthc…",126172.61,126172.61
Data Engineer,Forhyre,"We are looking for a passionate certified Data Engineer. The successful candidate will turn data into information, information into insight and insight into business decisions. Data analyst responsibilities include conducting full lifecycle analysis to include requirements, activities and design. Data analysts will develop analysis and reporting capabilities. They will also monitor performance and quality control plans to identify improvements. Primary skillset: Python/Pyspark & Azure, ADF, SQL…",100000.0,160000.0
Data Engineer,Air Apps,"About Air Apps At Air Apps, we believe in thinking bigger—and moving faster. We’re a family-founded company on a mission to create the world’s first AI-powered Personal & Entrepreneurial Resource Planner (PRP), and we need your passion and ambition to help us change how people plan, work, and live. Born in Lisbon, Portugal in 2018—and now with offices in both Lisbon and San Francisco—we’ve remained self-funded while reaching over 100 million downloads worldwide. Our long-term focus drives us to…",111000.0,196000.0
Sr Solution Architect,Stefanini Group,"Details: Stefanini Group is hiring! Stefanin i is looking for Sr Solution Architect-Remote For quick apply, please contact Sudhanshu Shrivastava: (248) 582-6510/ sudhanshu.shrivastava@stefanini.com W2 Only! Responsibilities: Must have hands-on for performing technical analysis and troubleshooting on highly complex integrated systems, including diagnostic approaches, determining root causes, and identifying solutions on a data lake house hosted in a cloud environment utilizing technologies such …",183526.67,183526.67
"Account Executive, Corporate Reputation",Ketchum,"About Ketchum As a global communications consultancy with 100 years of experience, Ketchum is a trusted partner who is equal parts creative and analytical. Ketchum is a place where all perspectives and points of view are welcome and encouraged. We are a collection of communications specialists, content creators, creatives, researchers, data analysts, media pros, digital strategists, issues and crisis counselors, and tech nerds. And we love when those worlds collide to create the very best teams…",93676.38,93676.38
Sr Solution Architect,Stefanini Group,"Job Description Stefanini Group is hiring! Stefanin i is looking for Sr Solution Architect-Remote For quick apply, please contact Sudhanshu Shrivastava: (248) 582-6510/ sudhanshu.shrivastava@stefanini.com W2 Only! Responsibilities: Must have hands-on for performing technical analysis and troubleshooting on highly complex integrated systems, including diagnostic approaches, determining root causes, and identifying solutions on a data lake house hosted in a cloud environment utilizing technologie…",184338.12,184338.12
