title,company,description,salary_min,salary_max
GCP Data Engineer,Recutify Inc.,"Role : GCP Data Engineer Location : Concord, CA (Onsite) Hire Type : Contract Job Description What You'll Do (Responsibilities): Architect & Design: Design and implement robust, scalable, and cost-effective data solutions on Google Cloud, serving as the target architecture for migrated workloads. Develop Reusable Frameworks & Accelerators: Design, build, and maintain reusable frameworks, templates, and code libraries to standardize and accelerate data engineering work. This includes creating bo…",104000.0,114400.0
Senior Product Operations Analyst,Windfall,"As a Senior Product Operations Analyst, you will report directly to Windfall’s VP of Product at the San Francisco headquarters. You will work closely with our engineering, data science, and customer success teams. You will play a key role in streamlining internal processes, creating analyses, and communicating findings to both internal and external stakeholders in slide decks that you construct. This role will give you an opportunity to advance your analytical skills. Working alongside an incre…",85000.0,110000.0
Data TPM,Insight Global,"Job Description - Own execution of the Code Engine modernization program, ensuring zero disruption to the existing sales process - Coordinate across 17 impacted teams, aligning timelines, milestones, and readiness plans - Track and manage dependencies across teams, including close partnership with Kamal's organization - Translate the larger program roadmap into team level implementation plans and mitigation strategies - Build and maintain program plans, timelines, and milestone tracking using G…",93337.69,93337.69
"Manager, Product Operations",Windfall,"The Product Operations Manager reports directly to the VP of Product at Windfall's San Francisco headquarters. Specifically, this team is a ""player/coach"" role where you will be responsible for your own work but also manage a small team of Product Operation Analysts. You will work closely with our engineering, data science, and customer success teams. You will play a key role in streamlining internal processes, creating analysis, and communicating findings to both internal and external stakehol…",151215.2,151215.2
Principal Data Engineer,Salesforce,"To get the best candidate experience, please consider applying for a maximum of 3 roles within 12 months to ensure you are not duplicating efforts. Job Category Data Job Details About Salesforce Salesforce is the 1 AI CRM, where humans with agents drive customer success together. Here, ambition meets action. Tech meets trust. And innovation isn’t a buzzword — it’s a way of life. The world of work as we know it is changing and we're looking for Trailblazers who are passionate about bettering bus…",197300.0,313700.0
EPIC Cupid/Radiant Application Analyst - San Francisco CA/On-Site,STI,"EPIC Cupid/Radiant Application Analyst San Francisco CA/On-Site Contract Job Description : What specific experience, background, and/or qualifications are you looking for in candidates for this position? Cupid certification and a strong Cupid background (implementation as well as support); Also required to be certified in Radiant and will help support the on-call rotation for both applications. Please verify any certificates and/or licenses required for the position, if applicable: Epic Cupid a…",63472.86,63472.86
Lead Data Engineer,The State Bar of California,"Description Office of Information Technology Annual Salary Range Lead IT Analyst: $112,497 - $149,972 FLSA Exempt / Union Represented This position allows for up to four days of remote work per week About the Office The Office of Information Technology (IT) is responsible for enabling State Bar’s internal and external stakeholders by the management, implementation, and maintenance of an organization's technology to support of State Bar’s mission and goals. The office’s primary goals are to buil…",112497.0,149972.0
"Group Product Manager, Verticals",Lyft,"At Lyft, our purpose is to serve and connect. We aim to achieve this by cultivating a work environment where all team members belong and have the opportunity to thrive. Lyft connects people to transportation to change the way we live and get around our communities. We are looking for product managers who bring exceptional creative and analytical skills to drive forward a best in class product. Product management at Lyft leads the integration of engineering, data science, and design to achieve t…",176000.0,220000.0
Cloud Platform Engineer,"Energy and Environmental Economics, Inc","Cloud Platform Engineer Why Join the E3 Team When you join the E3 team, you will be working on some of the most important energy issues with some of the top minds in the electricity industry. We help shape energy and climate policy, play vital roles in regulatory proceedings, advise executives, and inform investment and planning selections. At E3, you will be challenged and inspired. E3 supports regulators, utilities, investors, and policymakers with rigorous energy and climate modeling that in…",140000.0,165000.0
"Group Product Manager II, Pricing",Lyft,"At Lyft, our purpose is to serve and connect. We aim to achieve this by cultivating a work environment where all team members belong and have the opportunity to thrive. Lyft connects people to transportation to change the way we live and get around our communities. We are looking for product managers who bring exceptional creative, strategic, and analytical skills to drive forward a best in class product. Product management at Lyft leads the integration of engineering, data science, and design …",208000.0,260000.0
"Senior Data Scientist - Optimization, Central Market Management & AI",Lyft,"At Lyft, our purpose is to serve and connect. We aim to achieve this by cultivating a work environment where all team members belong and have the opportunity to thrive. The Central Market Management & AI (CMM&AI) team, a key part of the broader Rideshare Experience & Marketplace organization, is essential for maintaining a balanced and efficient marketplace. We do so by developing foundational models, business datasets, and decision-making applications that support a wide range of teams across …",284090.7,284090.7
"Customer and Partners Solutions Engineering, gUP Analytics",Google,"Customer and Partners Solutions Engineering, gUP Analytics _corporate_fare_ Google _place_ Boulder, CO, USA; Atlanta, GA, USA; 4 more; 3 more Mid Experience driving progress, solving problems, and mentoring more junior team members; deeper expertise and applied knowledge within relevant area. _info_outline_ XThe application window will be open until at least April 15, 2026. This opportunity will remain online based on business needs which may be before or after the specified date. Applicants in…",142827.02,142827.02
"Staff Data Scientist, Ad Measurement Products",Pinterest,"About Pinterest: Millions of people around the world come to our platform to find creative ideas, dream about new possibilities and plan for memories that will last a lifetime. At Pinterest, we’re on a mission to bring everyone the inspiration to create a life they love, and that starts with the people behind the product. Discover a career where you ignite innovation for millions, transform passion into growth opportunities, celebrate each other’s unique experiences and embrace the flexibility …",232791.11,232791.11
"Senior Software Engineer, Secure Cards",Chime Financial,"About the role Chime’s Secured Card team is hiring an engineer to help scale and evolve Chime Card—our flagship product that helps members safely build credit without debt. In this role, you’ll dive into high-impact projects across our service architecture, collaborating with product, risk, and design partners to deliver resilient, secure systems. While your focus will be backend, we're looking for someone who’s excited to roll up their sleeves and contribute wherever it’s needed most to move t…",147753.31,147753.31
AI Research Engineer,Hex Technologies,"About the role Hex is an AI-powered platform for modern Data Science and Data Analytics workflows. AI Research Engineers at Hex partner with product teams to build industry-leading AI experiences such as the Notebook Agent . In the process, AI Research Engineers will run experiments, fine-tune models, deploy AI infrastructure, and build and maintain experimentation tooling. As an AI Research Engineer partnered with Hex's product teams, your focus will be driving Hex's context engine and pushing…",214000.0,285000.0
Lead Product Manager - Identity,Uber,"About the Role At Uber, identity is the cornerstone of trust and safety, essential to our platform's integrity and long-term success. As a Lead Product Manager for Identity Verification, you will develop and scale world-class identity solutions that enhance security while ensuring seamless user experiences for hundreds of millions of users globally. In this role, you will drive execution at scale, influence senior stakeholders, and mentor a high-performing team in a fast-paced, high-stakes envi…",141926.53,141926.53
Salesforce Technical Project Manager,Komforce,"ABOUT THE ROLE We are looking for a Salesforce Technical Project Manager with strong Salesforce Platform delivery experience to lead client-facing implementations end-to-end. This is an on-site engagement requiring presence at the client's office 3 days per week in the San Francisco Bay Area. The right candidate brings a strong technical background in the Salesforce platform, proven project management skills, and the ability to run delivery workstreams across architects, developers, business an…",141212.19,141212.19
"Lead, Data Operations & Evaluation Engineering",Arcade,"About Arcade Arcade is building the world’s first AI physical product creation platform, where imagination becomes reality. Our platform lets anyone design, purchase, and sell custom, manufacturable products using natural language and generative AI. We believe everyone should have the power to create physical goods as easily as they post online, and we’re building the infrastructure to make that real for both consumers and businesses. We’ve raised $42M from a world-class group of investors, inc…",188427.6,188427.6
Senior ETL / BI Application Engineer,Conduent,"This is not a developer role, though collaboration with developers may occur. This position will be a member of a broader ETL/BI team, so experience administering Cognos and Tableau with Medicaid Enterprise Data Warehouse, Pharmacy Benefits or Medicaid Management Information System operating environments is required, with hands on experience with Business Objects and / or Informatica a significant plus. Responsibilities Cognos Platform Administration • Install, configure, upgrade, and patch Tab…",96951.02,96951.02
Abuse Investigator - Child Safety,OpenAI,"About the Team OpenAI’s mission is to ensure that general-purpose artificial intelligence benefits all of humanity. We believe achieving this goal requires real-world deployment and continuous iteration based on how our products are used—and misused—in practice. The Intelligence and Investigations team supports this mission by identifying, analyzing, and investigating misuse of our products, particularly novel or emerging abuse patterns. Our work enables partner teams to develop data-backed pro…",158400.0,425000.0
"Manager, Social & Influencer Measurement",Adobe,"About the Opportunity and Team Social Media, Creators, and Communities are transforming how brands build relevance and long-term customer relationships. These channels generate rich, fast-moving signals across culture, conversation, sentiment, and performance—introducing new challenges around measurement, attribution, and sustained impact across the entire customer journey. Within the Growth Marketing & Insights organization, our team develops actionable Category & Customer Insights and measure…",128100.0,265800.0
"Staff Product Manager, Content Experience",Databricks,"RDQ426R242 Databricks is a powerful, technical platform used by a diverse and growing range of personas, from data scientists and engineers to analysts and business leaders, to developers. To help these users succeed, we need world-class content that is timely, contextual, accurate, and helps users achieve their goals. This leads to faster adoption, lower support costs, and higher customer satisfaction. Achieving this impact requires a strategic shift: treating content as part of the product . …",138662.08,138662.08
"Sr. Product Manager, Databricks Repos",Databricks,"RDQ427R130 At Databricks, we are passionate about enabling data teams to solve the world’s toughest problems — from making the next mode of transportation a reality to accelerating the development of medical breakthroughs. We do this by building and running the world’s best data and AI infrastructure platform so our customers can use deep data insights to improve their business. Founded by engineers — and customer obsessed — we leap at every opportunity to tackle technical challenges, from desi…",170315.23,170315.23
Data Engineer (San Francisco),Free Streaming Content,"Data Engineer (San Francisco, CA) About Atmosphere: Atmosphere is the world’s first and largest free ad-supported streaming TV service for businesses offering original, owned, and operated TV channels along with Partner Channels from prominent brands. The platform has been built from the ground up with proprietary content, technology, and data to deliver unparalleled experiences for businesses and advertisers. The platform also provides a paid upgrade to a digital signage feature for businesses…",78891.62,78891.62
"Staff Data Scientist, GTM",Harvey,"Why Harvey At Harvey, we’re transforming how legal and professional services operate — not incrementally, but end-to-end. By combining frontier agentic AI, an enterprise-grade platform, and deep domain expertise, we’re reshaping how critical knowledge work gets done for decades to come. This is a rare chance to help build a generational company at a true inflection point. With 1000 customers in 60 countries, strong product-market fit, and world-class investor support, we’re scaling fast and def…",170000.0,260000.0
"Staff Data Scientist, Marketing",Harvey,"Why Harvey At Harvey, we’re transforming how legal and professional services operate — not incrementally, but end-to-end. By combining frontier agentic AI, an enterprise-grade platform, and deep domain expertise, we’re reshaping how critical knowledge work gets done for decades to come. This is a rare chance to help build a generational company at a true inflection point. With 1000 customers in 60 countries, strong product-market fit, and world-class investor support, we’re scaling fast and def…",170000.0,260000.0
"Senior Product Manager, Adaptive Intelligence",Cloudflare,"About Us At Cloudflare, we are on a mission to help build a better Internet. Today the company runs one of the world’s largest networks that powers millions of websites and other Internet properties for customers ranging from individual bloggers to SMBs to Fortune 500 companies. Cloudflare protects and accelerates any Internet application online without adding hardware, installing software, or changing a line of code. Internet properties powered by Cloudflare all have web traffic routed through…",197423.36,197423.36
Head of Strategy & Analytics,Speak,"About us Our mission is to reinvent the way people learn, starting with language. Learning a language can change a life by opening doors to new cultures, careers, and communities. Two billion people around the world are actively trying to learn a language, but the best way to learn (one-on-one tutoring) is hard to access at scale and hasn’t been meaningfully improved in decades. Speak is building a human-level, AI-powered tutor in your pocket: a conversation-first experience that lets learners …",200000.0,280000.0
"Data Scientist, Product",OpenAI,"About the Team Our Applied team brings OpenAI technologies to consumers and businesses around the world. We collaborate across research, engineering, design and business functions to turn cutting-edge AI advancements into impactful real-world applications. Our team has been behind notable product launches ( ChatGPT , API , Sora ), creating tools that help developers write code, enable businesses to operate more efficiently, and empower individuals to learn and create. As AI capabilities rapidly…",230000.0,385000.0
"Senior Manager Data Science, Revenue & Growth",Checkr,"About Checkr Checkr is building the data platform to power safe and fair decisions. Checkr’s innovative technology and robust data platform help customers assess risk and ensure safety and compliance to build trusted workplaces and communities. Checkr has over 100,000 customers including Amazon, DoorDash, Kia, Kimpton, McDonalds, and Netflix. We’re a team that thrives on solving complex problems with innovative solutions that advance our mission. Checkr is recognized on Forbes Cloud 100 2025 Li…",268000.0,315000.0
Senior Product Analytics Engineer,Faire,"About Faire Faire is an online wholesale marketplace built on the belief that the future is local — independent retailers around the globe are doing more revenue than Walmart and Amazon combined, but individually, they are small compared to these massive entities. At Faire, we're using the power of tech, data, and machine learning to connect this thriving community of entrepreneurs across the globe. Picture your favorite boutique in town — we help them discover the best products from around the…",196000.0,269500.0
"Senior Data Scientist - Optimization, Central Market Management & AI",Lyft,"At Lyft, our purpose is to serve and connect. We aim to achieve this by cultivating a work environment where all team members belong and have the opportunity to thrive. The Central Market Management & AI (CMM&AI) team, a key part of the broader Rideshare Experience & Marketplace organization, is essential for maintaining a balanced and efficient marketplace. We do so by developing foundational models, business datasets, and decision-making applications that support a wide range of teams across …",148000.0,185000.0
"Senior Manager Data Science, Revenue & Growth",Checkr,"About Checkr Checkr is building the data platform to power safe and fair decisions. Established in 2014, Checkr’s innovative technology and robust data platform help customers assess risk and ensure safety and compliance to build trusted workplaces and communities. Checkr has over 100,000 customers including DoorDash, Coinbase, Lyft, Instacart, and Airtable. We’re a team that thrives on solving complex problems with innovative solutions that advance our mission. Checkr is recognized on Forbes C…",204967.77,204967.77
Flight Sciences Software Engineer,Astro Mechanica,"ABOUT US: Astro Mechanica is a vertically integrated aerospace company building a faster, more connected future. Our mission is to democratize high-speed flight by making supersonic travel flexible, accessible, and sustainable. We believe that rapid, on-demand, point-to-point global mobility will become the new standard for moving people and goods across the planet. To achieve this, we are integrating our advanced airframe and engine technologies—which include Duality™, our proprietary dual-use…",185000.0,215000.0
Partner Sales Manager,Prophecy,"About Prophecy Prophecy is building the next generation AI-powered data prep and analysis platform. Our platform enables business analysts and data teams to transform raw data into reliable, production-ready datasets and insights faster, using modern data infrastructure and AI-driven capabilities. We work with leading enterprises to simplify how organizations prepare, analyze, and operationalize data, while maintaining strong governance, security, and operational control. Our mission is to make…",156875.42,156875.42
Data Architect - Power & Utilities - Manager- Consulting - Location OPEN,EY,"Location: Anywhere in Country At EY, we're all in to shape your future with confidence. We'll help you succeed in a globally connected powerhouse of diverse teams and take your career wherever you want it to go. Join EY and help to build a better working world. AI & Data - Data Architecture - Manager - Power & Utilities Sector EY is seeking a motivated professional with solid experience in the utilities sector to serve as a Manager who possesses a robust background in Data Architecture, Data Mo…",165733.28,165733.28
Data Architect - Power & Utilities - Senior Manager- Consulting - Location OPEN,EY,"Location: Anywhere in Country At EY, we're all in to shape your future with confidence. We'll help you succeed in a globally connected powerhouse of diverse teams and take your career wherever you want it to go. Join EY and help to build a better working world. AI & Data - Data Architecture - Senior Manager - Power & Utilities Sector EY is seeking a motivated professional with solid experience in the utilities sector to serve as a Senior Manager who possesses a robust background in Data Archite…",178234.38,178234.38
"Data Architect - Aerospace, Defense & Mobility - Senior Manager- Consulting - Location OPEN",EY,"Location: Anywhere in Country At EY, we're all in to shape your future with confidence. We'll help you succeed in a globally connected powerhouse of diverse teams and take your career wherever you want it to go. Join EY and help to build a better working world. AI & Data - Data Architecture - Senior Manager - Power & Utilities Sector EY is seeking a motivated professional with solid experience in the automotive and aerospace sector to serve as a Senior Manager who possesses a robust background …",196338.84,196338.84
Data Engineer,Abridge,"About Abridge Abridge was founded in 2018 with the mission of powering deeper understanding in healthcare. Our AI-powered platform was purpose-built for medical conversations, improving clinical documentation efficiencies while enabling clinicians to focus on what matters most—their patients. Our enterprise-grade technology transforms patient-clinician conversations into structured clinical notes in real-time, with deep EMR integrations. Powered by Linked Evidence and our purpose-built, auditab…",185000.0,217000.0
"Product & Solutions Lead, Safety and Security",OpenAI,"About the Team The Intelligence & Investigations (I2) team detects and disrupts abuse and strategic risks so people can use AI safely. We translate real-world signals, investigations, and external threat intelligence into practical mitigations, operating guidance, and partner-ready support that improves safety outcomes across the AI ecosystem. About the Role As a Product & Solutions Lead focused on safety and security, you will build and operate 0–1 products, services, and technical solution pa…",288000.0,425000.0
Sr. APeX Application Analyst - Willow,UCSF Campus and Health,"Job Summary This position requires regular work onsite. The Sr. APeX Application Analyst functions as the primary support contact and expert for the application. They work under the direction of the Team Lead and/or Manager to configure, build & install the application. They coordinate all issues that arise during the project for their application area. Key operational activities include primary responsibility to analyze workflows and understand policies, procedures and constraints of the clini…",95873.62,95873.62
Director Of People Experience Insights and Operational Effectiveness,Google,"Director Of People Experience Insights and Operational Effectiveness _corporate_fare_ Google _place_ Mountain View, CA, USA; Ann Arbor, MI, USA; 10 more; 9 more _bar_chart_ Director _info_outline_ XThe application window will be open until at least May 6, 2026. This opportunity will remain online based on business needs which may be before or after the specified date. In accordance with Washington state law, we are highlighting our comprehensive benefits package, which is available to all eligi…",215280.36,215280.36
Senior Data Engineer,Tendo,"As a Senior Data Engineer, you will work within the Engineering team and contribute to Tendo’s strategic data engineering solutions by ingesting, transforming, and warehousing healthcare-related data from various sources. You will collaborate with Tendo’s Data Scientists, Product Managers, and Machine Learning Engineers to produce quality data flows and transformations that support advanced analytics and AI/ML model development. You will develop tools and solutions to facilitate data integratio…",127500.0,172500.0
Principal Data Engineer,Tendo,"As a Principal Data Engineer, you will work within the Engineering team and contribute to Tendo’s strategic data engineering solutions by ingesting, transforming, and warehousing healthcare-related data from various sources. You will collaborate with Tendo’s Data Scientists, Product Managers, and Machine Learning Engineers to produce quality data flows and transformations that support advanced analytics and AI/ML model development. You will develop tools and solutions to facilitate data integra…",157250.0,212750.0
Magnet Program Director,UCSF Campus and Health,"Job Summary The Magnet Program Director (MPD) at UCSF Health serves as a key strategist and is responsible for leading, coordinating, and sustaining all aspects of the ANCC Magnet Recognition Program designation and re-designation processes across the health system. Reporting to the System Chief Nurse Executive (CNE), this role provides strategic leadership to advance nursing excellence across the health system by integrating Magnet standards into organizational structures, professional practic…",273384.6,273384.6
